{
  "schemaVersion": 1,
  "contentRevision": 1,
  "id": "justice_team_prize",
  "worldId": "justice",
  "title": "جایزه‌ی کار گروهی",
  "summary": "یک گروه در مسابقه برنده شده است، اما اعضای آن به یک اندازه کار نکرده‌اند و حالا باید درباره‌ی تقسیم جایزه تصمیم بگیرند.",
  "recommendedMinAge": 9,
  "recommendedMaxAge": 12,
  "estimatedDurationMinutes": 10,
  "themes": [
    "justice",
    "teamwork",
    "contribution",
    "prize",
    "responsibility",
    "invisible_work"
  ],
  "introduction": {
    "title": "گروه برنده",
    "body": "چهار نفر در یک مسابقه‌ی کلاسی درباره‌ی ساخت یک پوستر آموزشی برنده شده‌اند. جایزه این است که گروه بتواند چهار کتاب برای کتابخانه‌ی کلاس انتخاب کند و نام گروه کنار پوستر نصب شود. حالا بچه‌ها می‌خواهند تصمیم بگیرند نقش هر نفر چطور دیده شود."
  },
  "steps": [
    {
      "type": "narrative",
      "id": "scene",
      "title": "کارهای متفاوت",
      "body": "لیلا ایده‌ی اصلی پوستر را داد. سام بیشتر بخش‌های دیده‌شده را طراحی کرد. کیان وسایل را آورد، نوشته‌ها را مرتب کرد و چند مشکل را حل کرد. نازنین به خاطر یک مسئولیت خانوادگی موقت کمتر در جلسات بود، اما نزدیک پایان یک پیشنهاد مهم داد که پوستر را خیلی بهتر کرد."
    },
    {
      "type": "single_choice",
      "id": "prize_choice",
      "question": "به نظر تو گروه چگونه منصفانه درباره‌ی جایزه و دیده شدن کارها تصمیم بگیرد؟",
      "options": [
        {
          "id": "equal_group",
          "label": "همه دقیقاً برابر دیده شوند، چون گروه با هم برنده شده."
        },
        {
          "id": "more_visible_work",
          "label": "کسی که کار بیشتری کرده بیشتر دیده شود."
        },
        {
          "id": "recognize_roles",
          "label": "نقش‌های متفاوت هر نفر جداگانه گفته شود."
        },
        {
          "id": "talk_first",
          "label": "اول درباره‌ی شرایط و تلاش‌ها گفت‌وگو کنند."
        }
      ]
    },
    {
      "type": "reason_prompt",
      "id": "reason_focus",
      "question": "کدام دلیل برای تو مهم‌تر است؟",
      "reasons": [
        {
          "id": "team_success",
          "label": "موفقیت گروهی"
        },
        {
          "id": "amount_of_work",
          "label": "مقدار کاری که هر نفر انجام داده"
        },
        {
          "id": "importance_of_idea",
          "label": "اهمیت ایده یا تغییر"
        },
        {
          "id": "invisible_work",
          "label": "کارهای کمتر دیده‌شده"
        },
        {
          "id": "circumstances",
          "label": "شرایطی که دست خود فرد نبوده"
        }
      ]
    },
    {
      "type": "perspective",
      "id": "equality_view",
      "speakerLabel": "لیلا",
      "viewpoint": "لیلا می‌گوید: «اگر جایزه‌ی گروهی است، شاید باید همه برابر دیده شویم. حتی ایده‌ی من بدون طراحی، وسایل و پیشنهاد آخر کامل نمی‌شد.»",
      "question": "این دیدگاه چه چیزی درباره‌ی کار گروهی نشان می‌دهد؟",
      "responses": [
        {
          "id": "group_makes_result",
          "label": "نتیجه‌ی گروهی به چند نقش وابسته است."
        },
        {
          "id": "equal_may_hide_difference",
          "label": "درست است، اما تفاوت تلاش‌ها هم پنهان می‌شود."
        }
      ]
    },
    {
      "type": "perspective",
      "id": "contribution_view",
      "speakerLabel": "سام",
      "viewpoint": "سام می‌گوید: «من ساعت‌های زیادی روی قسمت‌هایی کار کردم که همه می‌بینند. اگر همه چیز کاملاً برابر گفته شود، شاید تلاش بیشتر هیچ فرقی نکند.»",
      "question": "آیا تلاش بیشتر باید در تقسیم توجه یا جایزه اثر داشته باشد؟",
      "responses": [
        {
          "id": "effort_should_count",
          "label": "بله، تلاش بیشتر باید دیده شود."
        },
        {
          "id": "not_only_hours",
          "label": "گاهی بله، اما فقط ساعت کار مهم نیست."
        }
      ]
    },
    {
      "type": "counterexample",
      "id": "invisible_work_case",
      "title": "کاری که کمتر دیده شد",
      "scenario": "فرض کن بدون کار کیان، وسایل آماده نبود، نوشته‌ها گم می‌شد و گروه دیر تحویل می‌داد. بیشتر کارهای او در پوستر دیده نمی‌شود، اما نبودن آن‌ها نتیجه را خراب می‌کرد.",
      "question": "آیا فقط کارهای دیده‌شده باید بیشتر حساب شوند؟",
      "choices": [
        {
          "id": "visible_counts_more",
          "label": "بله، چون نتیجه‌ی نهایی همان است که دیده می‌شود."
        },
        {
          "id": "invisible_counts",
          "label": "نه، کارهای پنهان هم می‌توانند مهم باشند."
        },
        {
          "id": "both_count",
          "label": "هر دو نوع کار باید سنجیده شوند."
        }
      ]
    },
    {
      "type": "perspective",
      "id": "circumstance_view",
      "speakerLabel": "نازنین",
      "viewpoint": "نازنین می‌گوید: «من کمتر در جلسه‌ها بودم، چون چند روز باید بعد از مدرسه به خانواده‌ام کمک می‌کردم. اما وقتی برگشتم، پیشنهادی دادم که پوستر روشن‌تر شد. نمی‌خواهم بیشتر از حقم دیده شوم، فقط دوست دارم شرایطم هم فهمیده شود.»",
      "question": "شرایط بیرونی چه اثری بر قضاوت منصفانه دارد؟",
      "responses": [
        {
          "id": "circumstances_matter",
          "label": "باید شرایط را هم فهمید."
        },
        {
          "id": "result_still_matters",
          "label": "شرایط مهم است، اما نتیجه و همکاری هم مهم‌اند."
        }
      ]
    },
    {
      "type": "counterexample",
      "id": "limited_prize",
      "title": "جایزه‌ی محدود",
      "scenario": "فرض کن به جای انتخاب چهار کتاب، فقط دو جایگاه برای شرکت در یک کارگاه هنری وجود داشته باشد. گروه باید تصمیم بگیرد چه کسانی بروند یا آیا راه دیگری پیشنهاد کند.",
      "question": "وقتی جایزه برای همه کافی نیست، انصاف چه شکلی پیدا می‌کند؟",
      "choices": [
        {
          "id": "most_worked",
          "label": "کسانی بروند که بیشتر کار کرده‌اند."
        },
        {
          "id": "draw_or_rotate",
          "label": "قرعه یا نوبت‌گذاری منصفانه‌تر است."
        },
        {
          "id": "ask_shared_option",
          "label": "گروه راه مشترک یا جایگزین پیشنهاد کند."
        }
      ]
    },
    {
      "type": "reflection",
      "id": "final_reflection",
      "question": "حالا درباره‌ی جایزه‌ی کار گروهی چه فکر می‌کنی؟",
      "choices": [
        {
          "id": "equal_best",
          "label": "برابری گروهی را هنوز بهتر می‌دانم."
        },
        {
          "id": "contribution_best",
          "label": "تفاوت تلاش و نقش‌ها برایم مهم‌تر شد."
        },
        {
          "id": "role_context_best",
          "label": "باید نقش‌ها و شرایط با هم دیده شوند."
        },
        {
          "id": "still_unsure",
          "label": "هنوز مطمئن نیستم."
        }
      ]
    }
  ],
  "completion": {
    "title": "سهم در کار گروهی",
    "reflection": "در این مأموریت درباره‌ی برابری اعضای گروه، مقدار تلاش، کارهای دیده‌شده و کمتر دیده‌شده، شرایط بیرونی و موفقیت مشترک فکر کردی. انصاف در کار گروهی همیشه یک شکل ندارد؛ گاهی برابر دیدن همه مهم است، گاهی شناختن نقش‌های متفاوت، و گاهی گفت‌وگو درباره‌ی شرایطی که از بیرون روی کار اثر گذاشته است.",
    "familyPrompt": "اگر دوست داشتی، گفت‌وگو کن: در یک کار گروهی، چه چیزی باید بیشتر دیده شود؛ تلاش، نتیجه، ایده، یا همکاری؟"
  }
}
