{
  "schemaVersion": 1,
  "contentRevision": 1,
  "id": "truth_friend_secret",
  "worldId": "truth",
  "title": "راز دوست",
  "summary": "هستی رازی از دوستش می‌شنود و باید فکر کند چه زمانی رازداری درست است و چه زمانی ممکن است به کسی آسیب برسد.",
  "recommendedMinAge": 10,
  "recommendedMaxAge": 12,
  "estimatedDurationMinutes": 10,
  "themes": [
    "truth",
    "secrecy",
    "loyalty",
    "trust",
    "harm",
    "responsibility"
  ],
  "introduction": {
    "title": "قولی که ساده نیست",
    "body": "هستی از دوستش مانا می‌شنود که برای مسابقه‌ی کلاس، ایده‌ی کاردستی‌اش را بیشتر از کار رها برداشته است. مانا می‌گوید: «به کسی نگو. فقط می‌خواستم این بار کارم بهتر دیده شود.» هستی قول نداده بود، اما حالا یک راز می‌داند. اگر هیچ‌کس نفهمد، شاید رها حقش را از دست بدهد."
  },
  "steps": [
    {
      "type": "narrative",
      "id": "quiet_corner",
      "title": "میان دوستی و انصاف",
      "body": "هستی مانا را دوست دارد و نمی‌خواهد او شرمنده شود. از طرف دیگر، فکر می‌کند رها هم برای ایده‌اش زحمت کشیده است. گفتن ماجرا به همه می‌تواند مانا را ناراحت کند؛ نگفتن هم شاید باعث شود یک اشتباه پنهان بماند."
    },
    {
      "type": "single_choice",
      "id": "secret_choice",
      "question": "هستی با رازی که شنیده چه کار باید بکند؟",
      "options": [
        {
          "id": "keep_secret",
          "label": "راز را نگه دارد."
        },
        {
          "id": "tell_others",
          "label": "موضوع را به دیگران بگوید."
        },
        {
          "id": "talk_first",
          "label": "اول با مانا گفت‌وگو کند."
        },
        {
          "id": "think_more",
          "label": "پیش از هر کاری بیشتر فکر کند."
        }
      ]
    },
    {
      "type": "reason_prompt",
      "id": "reason_focus",
      "question": "در این موقعیت چه چیزی مهم‌تر است؟",
      "reasons": [
        {
          "id": "loyalty",
          "label": "وفاداری به دوست"
        },
        {
          "id": "avoid_unfairness",
          "label": "جلوگیری از بی‌انصافی"
        },
        {
          "id": "promise_weight",
          "label": "ارزش نگه داشتن راز"
        },
        {
          "id": "chance_to_fix",
          "label": "فرصتی برای جبران اشتباه"
        },
        {
          "id": "telling_method",
          "label": "روش گفتن حقیقت"
        }
      ]
    },
    {
      "type": "perspective",
      "id": "loyalty_view",
      "speakerLabel": "مانا",
      "viewpoint": "مانا می‌گوید: «اگر دوستم باشی، این را پیش خودت نگه می‌داری. من به تو اعتماد کردم. شاید بعدا خودم راهی پیدا کنم، اما الان نمی‌خواهم همه بفهمند.»",
      "question": "آیا وفاداری به دوست همیشه یعنی ساکت ماندن؟",
      "responses": [
        {
          "id": "silence_can_be_loyal",
          "label": "گاهی سکوت بخشی از دوستی است."
        },
        {
          "id": "loyalty_can_question",
          "label": "گاهی دوست خوب بودن یعنی پرسیدن و کمک کردن."
        }
      ]
    },
    {
      "type": "counterexample",
      "id": "unfair_harm",
      "title": "اگر حق کسی گم شود",
      "scenario": "فرض کن معلم کار مانا را به عنوان بهترین ایده‌ی کلاس انتخاب کند و رها، که ایده‌ی اصلی از او بوده، هیچ فرصتی برای توضیح نداشته باشد. هستی هنوز نمی‌خواهد مانا را جلوی همه خجالت‌زده کند، اما می‌بیند سکوت او شاید روی رها اثر بگذارد.",
      "question": "آیا احتمال بی‌انصافی نسبت به رها، وظیفه‌ی هستی را درباره‌ی راز تغییر می‌دهد؟",
      "choices": [
        {
          "id": "changes_duty",
          "label": "بله، چون راز به دیگری هم مربوط شده است."
        },
        {
          "id": "partly_changes",
          "label": "تا حدی، اما روش برخورد هم مهم است."
        },
        {
          "id": "still_secret",
          "label": "نه، راز دوست باید پنهان بماند."
        }
      ]
    },
    {
      "type": "perspective",
      "id": "private_talk_view",
      "speakerLabel": "هستی",
      "viewpoint": "هستی فکر می‌کند شاید بتواند اول با مانا حرف بزند و از او بخواهد خودش اشتباهش را جبران کند؛ مثلا ایده‌ی رها را نام ببرد یا از معلم بخواهد فرصت توضیح بدهد.",
      "question": "آیا دادن فرصت برای جبران، راه منصفانه‌ای میان سکوت و گفتن است؟",
      "responses": [
        {
          "id": "fair_chance",
          "label": "بله، چون به مانا فرصت درست کردن می‌دهد."
        },
        {
          "id": "may_not_be_enough",
          "label": "شاید کافی نباشد اگر رها همچنان آسیب ببیند."
        }
      ]
    },
    {
      "type": "reflection",
      "id": "final_reflection",
      "question": "بعد از دیدن وفاداری، سکوت، انصاف و روش گفتن حقیقت، نگاهت به رازداری چه شد؟",
      "choices": [
        {
          "id": "more_complex",
          "label": "رازداری برایم پیچیده‌تر شد."
        },
        {
          "id": "method_matters",
          "label": "فهمیدم روش گفتن حقیقت مهم است."
        },
        {
          "id": "same_view",
          "label": "هنوز همان نظر اول را دارم."
        },
        {
          "id": "need_more_talk",
          "label": "دوست دارم بیشتر درباره‌اش حرف بزنم."
        }
      ]
    }
  ],
  "completion": {
    "title": "راز، دوستی و انصاف",
    "reflection": "در این داستان رازداری فقط خوب یا بد نبود. درباره‌ی وفاداری، اعتماد، احتمال آسیب، انصاف و راه‌های گفتن حقیقت فکر کردی. گاهی پرسش مهم این نیست که فقط بگوییم یا نگوییم؛ این هم مهم است که چگونه و با چه دلیلی عمل کنیم.",
    "familyPrompt": "اگر دوست داشتی، با یک بزرگ‌تر درباره‌ی این پرسش حرف بزن: چه فرقی هست میان غیبت کردن، کمک خواستن و گفتن حقیقت برای جلوگیری از بی‌انصافی؟"
  }
}
