{
  "schemaVersion": 1,
  "contentRevision": 1,
  "id": "justice_playground_rule",
  "worldId": "justice",
  "title": "قانون تازه‌ی حیاط",
  "summary": "مدرسه برای جلوگیری از بی‌نظمی قانونی تازه می‌گذارد، اما این قانون برای همه به یک اندازه منصفانه به نظر نمی‌رسد.",
  "recommendedMinAge": 9,
  "recommendedMaxAge": 12,
  "estimatedDurationMinutes": 10,
  "themes": [
    "justice",
    "law",
    "equality",
    "authority",
    "exceptions",
    "protest"
  ],
  "introduction": {
    "title": "زنگ تفریح شلوغ",
    "body": "چند روز پشت سر هم، بازی با توپ در حیاط مدرسه باعث بحث و برخوردهای ناخواسته شده است. مسئولان مدرسه می‌خواهند زنگ تفریح آرام‌تر و امن‌تر باشد. برای همین قانون تازه‌ای می‌گذارند: هیچ‌کس در زنگ تفریح حق ندارد در حیاط با توپ بازی کند."
  },
  "steps": [
    {
      "type": "narrative",
      "id": "scene",
      "title": "یک قانون برای همه",
      "body": "قانون برای همه‌ی کلاس‌ها یکسان است. بعضی بچه‌ها می‌گویند این یعنی انصاف، چون کسی استثنا نشده. بعضی دیگر می‌گویند فقط چند بازی شلوغ مشکل درست کرده بود و حالا بازی‌های آرام و مراقب هم ممنوع شده‌اند. هیچ‌کس نمی‌خواهد کسی آسیب ببیند، اما همه درباره‌ی راه درست توافق ندارند."
    },
    {
      "type": "single_choice",
      "id": "rule_fairness_choice",
      "question": "به نظر تو قانون تازه منصفانه است؟",
      "options": [
        {
          "id": "fair_same_for_all",
          "label": "بله، چون برای همه یکسان است."
        },
        {
          "id": "unfair_too_broad",
          "label": "نه، چون همه را به خاطر رفتار چند نفر محدود می‌کند."
        },
        {
          "id": "fair_for_safety",
          "label": "شاید، چون امنیت حیاط مهم است."
        },
        {
          "id": "needs_revision",
          "label": "باید قانون دقیق‌تری پیدا شود."
        }
      ]
    },
    {
      "type": "reason_prompt",
      "id": "reason_focus",
      "question": "کدام دلیل در داوری تو مهم‌تر است؟",
      "reasons": [
        {
          "id": "same_rule",
          "label": "اجرای یکسان قانون"
        },
        {
          "id": "safety",
          "label": "امنیت بچه‌ها"
        },
        {
          "id": "not_punish_all",
          "label": "محدود نکردن همه به خاطر چند نفر"
        },
        {
          "id": "play_need",
          "label": "نیاز به بازی و حرکت"
        },
        {
          "id": "better_rule",
          "label": "دقیق‌تر بودن قانون"
        }
      ]
    },
    {
      "type": "perspective",
      "id": "authority_view",
      "speakerLabel": "معاون مدرسه",
      "viewpoint": "معاون می‌گوید: «ما نمی‌خواهیم بازی را از بچه‌ها بگیریم. اما وقتی چند بار بحث و برخورد پیش آمده، باید راهی پیدا کنیم که زنگ تفریح برای همه امن‌تر باشد. قانون یکسان کمک می‌کند کسی احساس نکند با او فرق گذاشته‌ایم.»",
      "question": "این دیدگاه چه چیزی را به مسئله اضافه می‌کند؟",
      "responses": [
        {
          "id": "safety_responsibility",
          "label": "مسئولان مدرسه باید به امنیت فکر کنند."
        },
        {
          "id": "intention_not_enough",
          "label": "نیت خوب مهم است، اما قانون هم باید دقیق باشد."
        }
      ]
    },
    {
      "type": "perspective",
      "id": "student_view",
      "speakerLabel": "چند دانش‌آموز",
      "viewpoint": "آن‌ها می‌گویند: «ما همیشه آرام بازی می‌کردیم و مراقب بودیم. حالا همان محدودیتی را داریم که کسانی دارند که بی‌دقت بازی کردند. آیا انصاف یعنی همه دقیقاً یک قانون داشته باشند، حتی اگر رفتارشان فرق داشته؟»",
      "question": "آیا قانون یکسان همیشه نتیجه‌ی منصفانه می‌دهد؟",
      "responses": [
        {
          "id": "same_can_be_fair",
          "label": "گاهی بله، چون تبعیض کم می‌شود."
        },
        {
          "id": "same_can_be_unfair",
          "label": "گاهی نه، چون وضعیت‌ها متفاوت‌اند."
        }
      ]
    },
    {
      "type": "counterexample",
      "id": "revised_rule",
      "title": "قانون دقیق‌تر",
      "scenario": "فرض کن مدرسه قانون را تغییر دهد: فقط در بخش خط‌کشی‌شده‌ی حیاط، با توپ نرم و زیر نظر یک نوبت‌دار می‌شود بازی کرد. اگر بحث یا برخورد زیاد شود، بازی همان روز متوقف می‌شود.",
      "question": "آیا این قانون تازه منصفانه‌تر است؟",
      "choices": [
        {
          "id": "more_fair",
          "label": "بله، چون هم امنیت را می‌بیند هم بازی را."
        },
        {
          "id": "too_complicated",
          "label": "نه، چون اجرای آن سخت‌تر است."
        },
        {
          "id": "depends_enforcement",
          "label": "بستگی دارد درست و یکسان اجرا شود."
        }
      ]
    },
    {
      "type": "perspective",
      "id": "respectful_revision",
      "speakerLabel": "گفت‌وگوی کلاسی",
      "viewpoint": "بچه‌ها تصمیم می‌گیرند قانون را نشکنند، اما پیشنهادهایشان را محترمانه بنویسند و از مسئولان مدرسه بخواهند قانون را بعد از یک هفته دوباره بررسی کنند.",
      "question": "اعتراض محترمانه چه فرقی با نادیده گرفتن قانون دارد؟",
      "responses": [
        {
          "id": "keeps_order",
          "label": "هم نظم را نگه می‌دارد هم پرسش را زنده می‌کند."
        },
        {
          "id": "needs_listening",
          "label": "وقتی معنا دارد که طرف مقابل هم گوش بدهد."
        }
      ]
    },
    {
      "type": "reflection",
      "id": "final_reflection",
      "question": "حالا درباره‌ی قانون تازه چه فکر می‌کنی؟",
      "choices": [
        {
          "id": "law_ok",
          "label": "قانون یکسان را هنوز منصفانه‌تر می‌دانم."
        },
        {
          "id": "rule_too_broad",
          "label": "فکر می‌کنم قانون خیلی گسترده است."
        },
        {
          "id": "revision_best",
          "label": "قانون دقیق‌تر را بهتر می‌دانم."
        },
        {
          "id": "still_unsure",
          "label": "هنوز مطمئن نیستم."
        }
      ]
    }
  ],
  "completion": {
    "title": "قانون و انصاف",
    "reflection": "در این مأموریت درباره‌ی اجرای برابر قانون، امنیت، محدود کردن همه به خاطر رفتار چند نفر، دقت قانون، مسئولیت مسئولان و راه محترمانه‌ی پیشنهاد تغییر فکر کردی. قانون خوب فقط نیت خوب ندارد؛ باید تا جایی که می‌شود هم امن، هم روشن، هم قابل اجرا و هم منصفانه باشد.",
    "familyPrompt": "اگر دوست داشتی، گفت‌وگو کن: چه وقت یک قانون یکسان عادلانه است و چه وقت باید استثنا یا روش دقیق‌تری داشته باشد؟"
  }
}
