{
  "schemaVersion": 1,
  "contentRevision": 1,
  "id": "truth_strange_news",
  "worldId": "truth",
  "title": "خبر عجیب",
  "summary": "سام خبری عجیب در یک گروه می‌بیند و می‌خواهد پیش از بررسی آن را برای دیگران بفرستد.",
  "recommendedMinAge": 9,
  "recommendedMaxAge": 12,
  "estimatedDurationMinutes": 10,
  "themes": [
    "truth",
    "knowledge",
    "evidence",
    "trust",
    "rumor",
    "media_literacy"
  ],
  "introduction": {
    "title": "پیامی که تند پخش می‌شود",
    "body": "سام در گروه محله پیامی می‌بیند: «به خاطر پیدا شدن یک لاک‌پشت خیلی بزرگ در حیاط مدرسه‌ها، چند روز کلاس‌ها تعطیل می‌شود. زود برای همه بفرستید!» کنار پیام، عکسی هیجان‌انگیز هم هست. دوست سام می‌گوید: «حتما درست است؛ خیلی‌ها فرستاده‌اند.»"
  },
  "steps": [
    {
      "type": "narrative",
      "id": "surprising_message",
      "title": "هیجان و تردید",
      "body": "سام هم هیجان‌زده شده و هم کمی شک دارد. اگر خبر درست باشد، شاید دوستانش باید زود بدانند. اگر درست نباشد، ممکن است او هم به پخش شدن یک اشتباه کمک کند. عکس واقعی به نظر می‌رسد، اما سام نمی‌داند از کجا آمده است."
    },
    {
      "type": "single_choice",
      "id": "forward_choice",
      "question": "سام پیش از فرستادن این خبر چه کار باید بکند؟",
      "options": [
        {
          "id": "send_fast",
          "label": "آن را زود برای دیگران بفرستد."
        },
        {
          "id": "check_source",
          "label": "اول دنبال نشانه‌ها و منبع خبر بگردد."
        },
        {
          "id": "send_with_uncertainty",
          "label": "بفرستد و بگوید هنوز مطمئن نیست."
        },
        {
          "id": "ask_friend",
          "label": "از دوستی که فرستاده بیشتر بپرسد."
        }
      ]
    },
    {
      "type": "reason_prompt",
      "id": "trust_reason",
      "question": "چه چیزی باعث می‌شود یک خبر را قابل اعتماد بدانی؟",
      "reasons": [
        {
          "id": "many_shared",
          "label": "تعداد کسانی که آن را فرستاده‌اند"
        },
        {
          "id": "trusted_source",
          "label": "قابل اعتماد بودن منبع"
        },
        {
          "id": "checkable_evidence",
          "label": "وجود نشانه‌های قابل بررسی"
        },
        {
          "id": "looks_familiar",
          "label": "شباهت به چیزهایی که قبلا شنیده‌ایم"
        },
        {
          "id": "clear_uncertainty",
          "label": "اینکه معلوم باشد چقدر مطمئن هستیم"
        }
      ]
    },
    {
      "type": "perspective",
      "id": "friend_repetition_view",
      "speakerLabel": "دوست سام",
      "viewpoint": "دوست سام می‌گوید: «من این پیام را از چند نفر دیده‌ام. اگر اشتباه بود، این همه آدم نمی‌فرستادند. تازه، کسی که برای من فرستاده معمولا آدم دقیقی است.»",
      "question": "اعتماد به دوست و زیاد تکرار شدن خبر چقدر می‌تواند دلیل خوبی باشد؟",
      "responses": [
        {
          "id": "trust_counts",
          "label": "می‌تواند یک نشانه باشد."
        },
        {
          "id": "not_enough",
          "label": "نشانه است، اما شاید کافی نباشد."
        }
      ]
    },
    {
      "type": "counterexample",
      "id": "same_original_mistake",
      "title": "پنجاه بار از یک جا",
      "scenario": "فرض کن پنجاه نفر همین خبر را فرستاده باشند، اما همه‌ی آن‌ها پیام را از یک نوشته‌ی اولیه گرفته باشند که هیچ‌کس بررسی نکرده است. در این حالت تعداد پیام‌ها زیاد است، اما سرچشمه‌ی خبر فقط یک جای نامطمئن است.",
      "question": "آیا زیاد تکرار شدن یک خبر، آن را درست می‌کند؟",
      "choices": [
        {
          "id": "repetition_not_truth",
          "label": "نه، تکرار به تنهایی حقیقت نمی‌سازد."
        },
        {
          "id": "repetition_some_clue",
          "label": "شاید فقط یک نشانه‌ی کوچک باشد."
        },
        {
          "id": "repetition_strong",
          "label": "اگر خیلی زیاد تکرار شود، مهم است."
        }
      ]
    },
    {
      "type": "single_choice",
      "id": "evidence_compare",
      "question": "کدام کار به سام بیشتر کمک می‌کند بفهمد چه چیزی را می‌داند و چه چیزی را فقط شنیده است؟",
      "options": [
        {
          "id": "find_origin",
          "label": "ببیند پیام نخستین از کجا آمده است."
        },
        {
          "id": "count_messages",
          "label": "فقط تعداد پیام‌های مشابه را بشمارد."
        },
        {
          "id": "ask_sender_confidence",
          "label": "از فرستنده بپرسد چقدر مطمئن است."
        },
        {
          "id": "compare_image_text",
          "label": "ببیند عکس واقعا همان ادعا را نشان می‌دهد یا نه."
        }
      ]
    },
    {
      "type": "perspective",
      "id": "urgency_view",
      "speakerLabel": "سام",
      "viewpoint": "سام با خودش فکر می‌کند: «اگر صبر کنم و خبر درست باشد، شاید دیگران دیر متوجه شوند. اگر عجله کنم و خبر غلط باشد، شاید باعث سردرگمی شوم.»",
      "question": "وقتی زمان مهم به نظر می‌رسد، سرعت و بررسی را چطور باید با هم سنجید؟",
      "responses": [
        {
          "id": "speed_matters",
          "label": "گاهی زود خبر دادن مهم است."
        },
        {
          "id": "checking_matters",
          "label": "گاهی مکث کوتاه جلوی اشتباه را می‌گیرد."
        }
      ]
    },
    {
      "type": "reflection",
      "id": "final_reflection",
      "question": "حالا بین «می‌دانم»، «باور دارم»، «شنیده‌ام» و «مطمئن نیستم» چه فرقی می‌بینی؟",
      "choices": [
        {
          "id": "clearer_difference",
          "label": "فرقشان برایم روشن‌تر شد."
        },
        {
          "id": "depends_on_case",
          "label": "بستگی به موقعیت دارد."
        },
        {
          "id": "same_view",
          "label": "هنوز همان نگاه اول را دارم."
        },
        {
          "id": "need_more_examples",
          "label": "برایم پرسش‌های تازه پیش آمد."
        }
      ]
    }
  ],
  "completion": {
    "title": "شنیدن با دانستن یکی نیست",
    "reflection": "در این مأموریت درباره‌ی اعتماد، تکرار، شاهد، منبع و عجله فکر کردی. گاهی یک خبر خیلی باورکردنی به نظر می‌رسد، اما هنوز باید دید ما چه چیزی را می‌دانیم، چه چیزی را باور کرده‌ایم و درباره‌ی چه چیزی هنوز مطمئن نیستیم.",
    "familyPrompt": "اگر دوست داشتی، با یک بزرگ‌تر درباره‌ی این پرسش حرف بزن: وقتی خبری را فقط شنیده‌ایم، چطور می‌توانیم با دقت و احترام درباره‌اش حرف بزنیم؟"
  }
}
