{
  "schemaVersion": 1,
  "contentRevision": 1,
  "id": "truth_group_photo",
  "worldId": "truth",
  "title": "عکس گروهی",
  "summary": "چند دوست می‌خواهند یک عکس گروهی را منتشر کنند، اما یکی از بچه‌ها با انتشار آن موافق نیست.",
  "recommendedMinAge": 9,
  "recommendedMaxAge": 12,
  "estimatedDurationMinutes": 9,
  "themes": [
    "truth",
    "privacy",
    "consent",
    "representation",
    "friendship",
    "digital_responsibility"
  ],
  "introduction": {
    "title": "بعد از پروژه",
    "body": "بعد از تمام شدن یک پروژه‌ی کلاسی، ترانه، رادین، نیکا و چند نفر دیگر کنار کاردستی‌شان عکس می‌گیرند. عکس خنده‌دار از آب درمی‌آید و بیشتر بچه‌ها دوست دارند آن را در صفحه‌ی کلاس بگذارند. نیکا آرام می‌گوید: «من از قیافه‌ام در این عکس خوشم نمی‌آید. لطفا منتشرش نکنید.» رادین جواب می‌دهد: «ولی عکس واقعی است و هیچ‌چیزش عوض نشده.»"
  },
  "steps": [
    {
      "type": "narrative",
      "id": "classroom_moment",
      "title": "یک عکس واقعی",
      "body": "بچه‌ها دور گوشی جمع شده‌اند. بعضی‌ها می‌خندند و می‌گویند این عکس خاطره‌ی خوبی از زحمت گروه است. نیکا لبخند نمی‌زند؛ او فکر می‌کند اگر عکس در گروه خانواده‌ها دیده شود، دیگران فقط به چهره‌ی او توجه می‌کنند، نه به پروژه."
    },
    {
      "type": "single_choice",
      "id": "share_choice",
      "question": "به نظر تو بچه‌ها باید عکس را منتشر کنند؟",
      "options": [
        {
          "id": "share_real",
          "label": "بله، چون عکس واقعی است."
        },
        {
          "id": "wait_for_nika",
          "label": "نه، چون نیکا موافق نیست."
        },
        {
          "id": "find_agreement",
          "label": "فقط اگر راهی پیدا کنند که همه راضی باشند."
        },
        {
          "id": "need_more_thought",
          "label": "برای تصمیم، باید بیشتر فکر کنند."
        }
      ]
    },
    {
      "type": "reason_prompt",
      "id": "reason_focus",
      "question": "در این تصمیم چه چیزی از همه مهم‌تر است؟",
      "reasons": [
        {
          "id": "image_is_real",
          "label": "واقعی بودن عکس"
        },
        {
          "id": "people_consent",
          "label": "رضایت کسانی که در عکس هستند"
        },
        {
          "id": "group_wish",
          "label": "خواست بیشتر اعضای گروه"
        },
        {
          "id": "sharing_result",
          "label": "نتیجه‌ای که انتشار عکس دارد"
        },
        {
          "id": "context_matters",
          "label": "معنایی که دیگران از عکس می‌گیرند"
        }
      ]
    },
    {
      "type": "perspective",
      "id": "memory_view",
      "speakerLabel": "ترانه",
      "viewpoint": "ترانه می‌گوید: «ما چند روز برای این پروژه زحمت کشیدیم. عکس دست‌کاری نشده و نشان می‌دهد کارمان را تمام کرده‌ایم. اگر منتشرش نکنیم، انگار یک خاطره‌ی واقعی را پنهان کرده‌ایم.»",
      "question": "این نگاه چه نکته‌ای درباره‌ی حقیقت عکس به بحث اضافه می‌کند؟",
      "responses": [
        {
          "id": "truth_visible",
          "label": "عکس می‌تواند بخشی از واقعیت را نشان دهد."
        },
        {
          "id": "not_whole_truth",
          "label": "واقعی بودن عکس شاید همه‌ی مسئله نباشد."
        }
      ]
    },
    {
      "type": "counterexample",
      "id": "caption_changes_meaning",
      "title": "وقتی نوشته کنار عکس می‌آید",
      "scenario": "فرض کن عکس همان عکس واقعی باشد، اما کسی زیرش بنویسد: «نیکا از پروژه خوشش نیامده بود.» در حالی که نیکا فقط از ظاهر خودش در عکس ناراحت است. خود عکس عوض نشده، اما نوشته ممکن است برداشت دیگران را عوض کند.",
      "question": "آیا یک عکس واقعی می‌تواند با یک توضیح نادرست، فهم اشتباهی بسازد؟",
      "choices": [
        {
          "id": "yes_mislead",
          "label": "بله، چون زمینه معنی عکس را تغییر می‌دهد."
        },
        {
          "id": "partly_mislead",
          "label": "تا حدی؛ عکس واقعی است اما کامل نیست."
        },
        {
          "id": "photo_enough",
          "label": "نه، چون خود عکس هنوز واقعی است."
        }
      ]
    },
    {
      "type": "perspective",
      "id": "nika_consent_view",
      "speakerLabel": "نیکا",
      "viewpoint": "نیکا می‌گوید: «من نمی‌گویم عکس دروغ است. فقط فکر می‌کنم وقتی صورت من در عکس است، باید درباره‌ی دیده شدنش هم نظر داشته باشم.»",
      "question": "آیا کسی که در یک تصویر واقعی حضور دارد، درباره‌ی انتشار آن سهمی در تصمیم دارد؟",
      "responses": [
        {
          "id": "person_has_say",
          "label": "بله، چون تصویر به او هم مربوط است."
        },
        {
          "id": "group_also_has_say",
          "label": "گروه هم سهم دارد، چون عکس گروهی است."
        }
      ]
    },
    {
      "type": "reflection",
      "id": "final_reflection",
      "question": "بعد از فکر کردن به واقعیت عکس، رضایت، زمینه و توضیح کنار عکس، نگاهت به انتشار آن چه شد؟",
      "choices": [
        {
          "id": "changed",
          "label": "نگاهم تغییر کرد."
        },
        {
          "id": "more_careful",
          "label": "حالا با احتیاط بیشتری فکر می‌کنم."
        },
        {
          "id": "same_with_reason",
          "label": "همان نظر را دارم، با دلیل روشن‌تر."
        },
        {
          "id": "still_thinking",
          "label": "هنوز در حال فکر کردنم."
        }
      ]
    }
  ],
  "completion": {
    "title": "عکس فقط یک تصویر نیست",
    "reflection": "در این گفت‌وگو دیدی که یک تصویر می‌تواند واقعی باشد، اما باز هم پرسش‌های دیگری داشته باشد: زمینه، توضیح، رضایت، حریم شخصی و اینکه دیگران چه برداشتی می‌کنند. لازم نیست همه به یک پاسخ برسند؛ مهم این است که دلیل‌ها و زاویه‌های مختلف دیده شوند.",
    "familyPrompt": "اگر دوست داشتی، با یک بزرگ‌تر درباره‌ی این پرسش حرف بزن: آیا هر چیز واقعی را می‌توان با هر روشی به دیگران نشان داد؟"
  }
}
