{
  "schemaVersion": 1,
  "contentRevision": 1,
  "id": "friendship_game_without_them",
  "worldId": "friendship",
  "title": "بازی بدون او",
  "summary": "یک گروه دوستان می‌خواهند بازی خودشان را ادامه دهند، اما یکی از بچه‌ها مرتب کنار گذاشته می‌شود.",
  "recommendedMinAge": 9,
  "recommendedMaxAge": 12,
  "estimatedDurationMinutes": 10,
  "themes": [
    "friendship",
    "inclusion",
    "exclusion",
    "group",
    "fairness",
    "responsibility",
    "belonging"
  ],
  "introduction": {
    "title": "بازی همیشگی",
    "body": "چند دوست بیشتر زنگ‌های تفریح یک بازی گروهی انجام می‌دهند. باران دوست دارد به آن‌ها ملحق شود، اما هنوز قوانین بازی را خوب بلد نیست و بازی با تعداد زیاد سخت‌تر می‌شود. بعضی بچه‌ها می‌گویند گروه باید بتواند خودش انتخاب کند با چه کسی بازی کند."
  },
  "steps": [
    {
      "type": "narrative",
      "id": "scene",
      "title": "کنار ماندن",
      "body": "باران یک بار کنار می‌ماند و چیزی نمی‌گوید. چند روز بعد دوباره همین اتفاق می‌افتد. سحر که دوست باران است، از دیدن این وضعیت ناراحت می‌شود. او نمی‌خواهد گروه را مجبور کند، اما فکر می‌کند تکرار کنار گذاشتن با یک‌بار جا نبودن فرق دارد."
    },
    {
      "type": "single_choice",
      "id": "inclusion_choice",
      "question": "دوستان باران باید چه کار کنند؟",
      "options": [
        {
          "id": "always_include",
          "label": "همیشه او را وارد بازی کنند."
        },
        {
          "id": "group_decides",
          "label": "اجازه دهند گروه خودش تصمیم بگیرد."
        },
        {
          "id": "rotate_turns",
          "label": "نوبتی بازی کنند تا افراد بیشتری شرکت کنند."
        },
        {
          "id": "other_activity",
          "label": "گاهی فعالیت دیگری پیدا کنند که باران هم بتواند در آن باشد."
        }
      ]
    },
    {
      "type": "reason_prompt",
      "id": "reason_focus",
      "question": "در این موقعیت چه چیزی مهم‌تر است؟",
      "reasons": [
        {
          "id": "group_freedom",
          "label": "آزادی گروه برای انتخاب"
        },
        {
          "id": "baran_belonging",
          "label": "احساس تعلق باران"
        },
        {
          "id": "game_rules",
          "label": "قواعد خودِ بازی"
        },
        {
          "id": "friend_responsibility",
          "label": "مسئولیت دوستان"
        },
        {
          "id": "possible_way",
          "label": "پیدا کردن راهی که برای بیشتر افراد ممکن باشد"
        }
      ]
    },
    {
      "type": "perspective",
      "id": "group_autonomy_view",
      "speakerLabel": "یکی از بچه‌ها",
      "viewpoint": "یکی از بچه‌ها می‌گوید: «دوستی اجباری نیست. ما باید بتوانیم انتخاب کنیم با چه کسی و چه بازی‌ای انجام دهیم. اگر همیشه مجبور باشیم بازی را عوض کنیم، دیگر بازی خودمان نیست.»",
      "question": "آیا گروه‌ها حق دارند برای بازی و دوستی خودشان مرز داشته باشند؟",
      "responses": [
        {
          "id": "boundaries_matter",
          "label": "بله، انتخاب گروه هم مهم است."
        },
        {
          "id": "boundaries_need_care",
          "label": "بله، اما مرزها نباید بی‌توجه و تکراری باشند."
        }
      ]
    },
    {
      "type": "perspective",
      "id": "repeated_exclusion_view",
      "speakerLabel": "سحر",
      "viewpoint": "سحر می‌گوید: «یک‌بار کنار ماندن با هر بار کنار گذاشته شدن فرق دارد. اگر همیشه او را نخواهیم، چه احساسی پیدا می‌کند؟ شاید لازم نباشد هر روز همان بازی را انجام دهیم.»",
      "question": "آیا تکرار شدن کنار گذاشتن معنای اخلاقی موقعیت را عوض می‌کند؟",
      "responses": [
        {
          "id": "repetition_changes",
          "label": "بله، تکرار می‌تواند مسئله را جدی‌تر کند."
        },
        {
          "id": "still_limits",
          "label": "شاید، اما محدودیت‌های بازی هم باقی می‌ماند."
        }
      ]
    },
    {
      "type": "counterexample",
      "id": "limited_capacity",
      "title": "وقتی جای کافی نیست",
      "scenario": "فرض کن بازی واقعاً فقط با چهار نفر خوب انجام می‌شود. اگر نفر پنجم اضافه شود، قواعد به هم می‌ریزد و هیچ‌کس درست بازی نمی‌کند. باران هم نمی‌خواهد فقط از روی دلسوزی وارد بازی شود.",
      "question": "اگر واقعاً جای کافی برای همه نباشد، چه روشی منصفانه‌تر است؟",
      "choices": [
        {
          "id": "fixed_group",
          "label": "گروه ثابت بماند."
        },
        {
          "id": "rotation",
          "label": "نوبت‌گذاری کنند."
        },
        {
          "id": "alternative",
          "label": "گاهی فعالیت دیگری انتخاب کنند."
        }
      ]
    },
    {
      "type": "perspective",
      "id": "compromise_view",
      "speakerLabel": "یک پیشنهاد",
      "viewpoint": "یکی پیشنهاد می‌کند بعضی روزها بازی را نوبتی انجام دهند و بعضی روزها فعالیت دیگری انتخاب کنند. با این کار گروه همیشه مجبور به تغییر نیست، اما باران هم هر بار کنار نمی‌ماند.",
      "question": "آیا تغییر دادن فعالیت گاهی سازش منصفانه است یا بار اضافه بر گروه؟",
      "responses": [
        {
          "id": "fair_compromise",
          "label": "می‌تواند سازش منصفانه‌ای باشد."
        },
        {
          "id": "burden_possible",
          "label": "ممکن است برای گروه هم بار داشته باشد."
        }
      ]
    },
    {
      "type": "reflection",
      "id": "final_reflection",
      "question": "حالا درباره‌ی بازی گروهی و کنار ماندن چه فکر می‌کنی؟",
      "choices": [
        {
          "id": "group_choice_first",
          "label": "انتخاب گروه را هنوز مهم‌ترین می‌دانم."
        },
        {
          "id": "repeated_exclusion_first",
          "label": "تکرار کنار گذاشتن برایم مهم‌تر شد."
        },
        {
          "id": "compromise_best",
          "label": "راهی میان انتخاب گروه و احساس تعلق بهتر است."
        },
        {
          "id": "still_unsure",
          "label": "هنوز مطمئن نیستم."
        }
      ]
    }
  ],
  "completion": {
    "title": "گروه، مرز و تعلق",
    "reflection": "در این مأموریت درباره‌ی احساس تعلق، آزادی گروه، تکرار کنار گذاشتن، محدودیت‌های عملی، مسئولیت دوستان و سازش فکر کردی. وارد کردن همه در هر بازی همیشه ممکن یا لازم نیست، اما کنار گذاشتن تکراری هم می‌تواند مسئله‌ای جدی شود. گاهی راه منصفانه میان مرز داشتن، نوبت دادن و پیدا کردن فعالیت مشترک ساخته می‌شود.",
    "familyPrompt": "اگر دوست داشتی، گفت‌وگو کن: آیا دعوت کردن کسی همیشه به معنای دوستی نزدیک است؟"
  }
}
