{
  "schemaVersion": 1,
  "contentRevision": 1,
  "id": "friendship_new_friend",
  "worldId": "friendship",
  "title": "دوست تازه",
  "summary": "دانش‌آموزی تازه به کلاس می‌آید و بچه‌ها فکر می‌کنند دوستی بیشتر به شباهت نیاز دارد یا به شناختن تفاوت‌ها.",
  "recommendedMinAge": 8,
  "recommendedMaxAge": 12,
  "estimatedDurationMinutes": 8,
  "themes": [
    "friendship",
    "difference",
    "similarity",
    "belonging",
    "empathy",
    "first_impressions"
  ],
  "introduction": {
    "title": "زنگ تفریح اول",
    "body": "مانی تازه به کلاس آمده است. او هنوز بازی گروهی بچه‌ها را خوب نمی‌شناسد و اول زنگ تفریح بیشتر کنار باغچه می‌ایستد. مانی از ساختن مدل‌های کاغذی و نگاه کردن به مورچه‌ها خوشش می‌آید. چند نفر کنجکاوند، اما نمی‌دانند برای شروع دوستی باید از شباهت‌ها شروع کنند یا از تفاوت‌ها."
  },
  "steps": [
    {
      "type": "narrative",
      "id": "scene",
      "title": "شروع آشنایی",
      "body": "در کلاس، نیلوفر می‌گوید دوستی وقتی راحت‌تر است که آدم‌ها بازی‌ها و علاقه‌های مشترک داشته باشند. رادین می‌گوید شاید لازم نباشد مانی مثل آن‌ها باشد؛ می‌شود اول فهمید او چه چیزهایی را دوست دارد. هیچ‌کس نمی‌خواهد مانی را مجبور کند یا نادیده بگیرد."
    },
    {
      "type": "single_choice",
      "id": "first_choice",
      "question": "بچه‌ها برای دوست شدن با مانی چه کار باید بکنند؟",
      "options": [
        {
          "id": "invite_game",
          "label": "از او بخواهند به بازی آن‌ها ملحق شود."
        },
        {
          "id": "ask_interest",
          "label": "از او بپرسند چه کاری را دوست دارد."
        },
        {
          "id": "wait_for_him",
          "label": "صبر کنند تا خودش دوست پیدا کند."
        },
        {
          "id": "shared_activity",
          "label": "کاری پیدا کنند که همه بتوانند در آن شریک شوند."
        }
      ]
    },
    {
      "type": "reason_prompt",
      "id": "reason_focus",
      "question": "چه چیزی برای شروع یک دوستی مهم‌تر است؟",
      "reasons": [
        {
          "id": "shared_interests",
          "label": "علاقه‌های مشترک"
        },
        {
          "id": "time_together",
          "label": "وقت گذراندن با هم"
        },
        {
          "id": "curiosity_difference",
          "label": "کنجکاوی درباره‌ی تفاوت‌ها"
        },
        {
          "id": "safe_belonging",
          "label": "احساس امنیت و پذیرفته شدن"
        },
        {
          "id": "not_sure",
          "label": "هنوز مطمئن نیستم"
        }
      ]
    },
    {
      "type": "perspective",
      "id": "similarity_view",
      "speakerLabel": "نیلوفر",
      "viewpoint": "نیلوفر می‌گوید: «دوستی وقتی راحت‌تر است که آدم‌ها بازی‌ها و علاقه‌های مشترک داشته باشند. اگر مانی هم بازی ما را دوست داشته باشد، حرف زدن و خندیدن با او آسان‌تر می‌شود.»",
      "question": "آیا شباهت برای دوستی لازم است یا فقط کمک می‌کند؟",
      "responses": [
        {
          "id": "similarity_needed",
          "label": "تا حدی لازم است، چون چیزی برای شریک شدن می‌دهد."
        },
        {
          "id": "similarity_helpful",
          "label": "کمک می‌کند، اما تنها راه دوستی نیست."
        }
      ]
    },
    {
      "type": "perspective",
      "id": "difference_view",
      "speakerLabel": "رادین",
      "viewpoint": "رادین می‌گوید: «شاید لازم نباشد مانی شبیه ما باشد. می‌توانیم اول بفهمیم او چه چیزهایی را دوست دارد. شاید از تفاوت‌ها هم چیز تازه‌ای یاد بگیریم.»",
      "question": "آیا شناختن تفاوت‌ها خودش می‌تواند بخشی از دوستی باشد؟",
      "responses": [
        {
          "id": "difference_can_start",
          "label": "بله، تفاوت می‌تواند کنجکاوی و گفت‌وگو بسازد."
        },
        {
          "id": "difference_needs_care",
          "label": "شاید، اگر کسی احساس فشار یا نمایش نکند."
        }
      ]
    },
    {
      "type": "counterexample",
      "id": "pretend_like",
      "title": "اگر وانمود کند",
      "scenario": "فرض کن مانی برای پذیرفته شدن وانمود کند بازی گروه را خیلی دوست دارد، اما واقعاً از آن لذت نبرد و فقط لبخند بزند تا کسی فکر نکند با بقیه فرق دارد.",
      "question": "اگر کسی برای دوست پیدا کردن خودش را متفاوت از آنچه هست نشان دهد، آیا این دوستی واقعی است؟",
      "choices": [
        {
          "id": "can_begin",
          "label": "شاید کمک کند دوستی شروع شود."
        },
        {
          "id": "less_honest",
          "label": "ممکن است دوستی را کمتر راستین کند."
        },
        {
          "id": "understand_not_last",
          "label": "قابل فهم است، اما شاید پایدار نباشد."
        }
      ]
    },
    {
      "type": "perspective",
      "id": "polite_or_friend",
      "speakerLabel": "مانی",
      "viewpoint": "مانی از این‌که بچه‌ها با او محترمانه حرف می‌زنند خوشحال است، اما هنوز نمی‌داند آیا آن‌ها فقط مؤدب‌اند یا واقعاً می‌خواهند او را بشناسند. او هم نمی‌خواهد همه مجبور شوند دوست نزدیکش شوند.",
      "question": "فرق احترام گذاشتن با دوست نزدیک شدن چیست؟",
      "responses": [
        {
          "id": "respect_first",
          "label": "احترام می‌تواند آغاز خوبی باشد."
        },
        {
          "id": "friendship_needs_time",
          "label": "دوستی نزدیک به زمان و شناخت بیشتری نیاز دارد."
        }
      ]
    },
    {
      "type": "reflection",
      "id": "final_reflection",
      "question": "حالا درباره‌ی شروع دوستی با کسی که کمی متفاوت است چه فکر می‌کنی؟",
      "choices": [
        {
          "id": "same_view",
          "label": "هنوز شباهت را مهم‌ترین می‌دانم."
        },
        {
          "id": "difference_matters",
          "label": "شناخت تفاوت‌ها برایم مهم‌تر شد."
        },
        {
          "id": "both_matter",
          "label": "فکر می‌کنم شباهت و تفاوت هر دو مهم‌اند."
        },
        {
          "id": "still_unsure",
          "label": "هنوز مطمئن نیستم."
        }
      ]
    }
  ],
  "completion": {
    "title": "آشنایی با احترام",
    "reflection": "در این مأموریت درباره‌ی شباهت، تفاوت، احساس تعلق، راستین بودن خود، فعالیت مشترک و کنجکاوی فکر کردی. احترام گذاشتن به کسی لازم است، اما دوستی نزدیک اجباری نیست. گاهی دوستی از علاقه‌ی مشترک شروع می‌شود و گاهی از گوش دادن به تفاوت‌ها، بدون این‌که کسی مجبور شود خودش را عوض کند.",
    "familyPrompt": "اگر دوست داشتی، گفت‌وگو کن: آیا برای دوست شدن باید حتماً چیزهای مشترک زیادی داشت؟"
  }
}
